{"schema": "standing-a100-development-sandbox/v1",
"study": "t34-watch-lead-1028",
"inputs": [{"kind": "frozen-checkpoint", "path": "/Users/josenunez/Projects/ml/snake-dqn/saved_snakes/b8_s3_t7_20261016.pth", "sha256": "3e64978337b67b7acaf4daa93bdefa827d8296bcb0f63413886a1aaad12eb4f8"}, {"kind": "frozen-opponent", "path": "/Users/josenunez/Projects/ml/snake-dqn/saved_snakes/frp3_m3_s12_u60000_20261005.pth", "sha256": "eec144bf92509a42664e2d650b8741f7d7774b86d7b6601d012bdd9425dd3723"}, {"kind": "registry", "path": "/Users/josenunez/Projects/ml/snake-dqn-p-watch-lead-09-broker.noindex/tools/sandbox/SANDBOX_INPUT_REGISTRY.json", "sha256": "39b80bcd4cca6a3e137206958fced3292f5aa5cb77e4f5f22cb9e810757ffc2c"}, {"kind": "verified-ledger", "path": "/Users/josenunez/Projects/ml/snake-dqn-p-watch-lead-09-broker.noindex/research/watch_lead_p/packet-09/verified-ledger.json", "sha256": "3569c7d351b8815c3deda957888dc139f2e1cb4616e3ec5163d14e02f61bbc7c"}, {"indices": [0, 1, 2, 3, 4, 5, 6, 7, 8, 9, 10, 11, 12, 13, 14, 15, 16, 17, 18, 19, 20, 21, 22, 23, 24, 25, 26, 27, 28, 29, 30, 31], "kind": "worlds", "seeds": [2168880377031932218, 10071873240431750991, 15393009754331107938, 16515493073144311175, 10614626573661681611, 13886017777194608760, 7181111940004599324, 6900035421666094672, 9478189718998027323, 1195258451975544034, 4126664253742600963, 1266098438787874316, 11918527333104547681, 16399870232390531543, 17491313639889495204, 17636221154521128513, 13063249588868297423, 16874640470768151165, 2853692031534786592, 13741628071613936521, 17397444138823693349, 13163277112582509100, 12268257070479232904, 17934558102307580826, 399984683189933270, 14134391532279673010, 12086744455100201436, 6793963675364626462, 13687134144856098516, 8734143073179297140, 6866398247332411526, 16953778385558344820], "study": "t34-watch-lead-1028"}],
"salt": "a100-dev/t34-watch-lead-1028/",
"endpoint": {"kind": "steps", "value": 576000},
"timeout": {"base_seconds": 14400, "purpose": "runaway-guard", "seconds": 28800},
"excluded_studies": ["F5", "F4-fold-0", "R30", "strict", "probe", "serving", "D4096", "TRAIN-01-monitor", "TRAIN-01-nomination", "t34-cf-1028", "engineering-indices-32-35"],
"owner_rule": "docs/research/governance_a100_sandbox_20261026/ADOPTED.md; T34 RULING 2026-10-28 section 4 P",
"outputs": {"broker_manifest": {"path": "/Users/josenunez/Projects/ml/snake-dqn-p-watch-lead-09-broker.noindex/research/watch_lead_p/packet-09/dispatch-manifest.json", "sha256": "7c88fffea67f7a31b669556920693fcef8d9f2c64136d2952cff29a7c8c0c32f"}, "label": "simulator-D", "paths": ["/Users/josenunez/Projects/ml/snake-dqn-artifacts/t34-watch-lead-1028/attempt-09/output"]},
"crossing": {"max_frozen_checkpoint_shas": 1}}
