{"schema": "standing-a100-development-sandbox/v1",
 "study": "t34-cf-1028",
 "inputs": [{"kind": "worlds", "study": "t34-cf-1028", "indices": [0, 10000000, 20000000], "seeds": [7346329180951467685, 17224823179812534439, 6298791552278646394]}, {"kind": "frozen-checkpoint", "path": "/Users/josenunez/Projects/ml/snake-dqn/saved_snakes/b8_s3_t7_20261016.pth", "sha256": "3e64978337b67b7acaf4daa93bdefa827d8296bcb0f63413886a1aaad12eb4f8"}, {"kind": "frozen-opponent", "path": "/Users/josenunez/Projects/ml/snake-dqn/saved_snakes/frp3_m3_s12_u60000_20261005.pth", "sha256": "eec144bf92509a42664e2d650b8741f7d7774b86d7b6601d012bdd9425dd3723"}, {"kind": "frozen-opponent", "path": "/Users/josenunez/Projects/ml/snake-dqn/saved_snakes/champion_a5_freespace_20260621.pth", "sha256": "43d4e2c53919dd59416c145cf0ba7c4faf1c7f298eebbb1723146807d747ac93"}, {"kind": "registry", "path": "/Users/josenunez/Projects/ml/snake-dqn-ct-1028-02-broker.noindex/tools/sandbox/SANDBOX_INPUT_REGISTRY.json", "sha256": "39b80bcd4cca6a3e137206958fced3292f5aa5cb77e4f5f22cb9e810757ffc2c"}, {"kind": "verified-ledger", "path": "/Users/josenunez/Projects/ml/snake-dqn-ct-1028-02-broker.noindex/research/sandbox_a_resident/packet-ct-1028-02/verified-ledger.json", "sha256": "dd0a462c99674ed5eca87d4c3207f1fe874a528d1e3141054aeafb0cbee6c9ab"}],
 "salt": "a100-dev/t34-cf-1028/",
 "endpoint": {"kind": "steps", "value": 39485440},
 "timeout": {"base_seconds": 43200, "seconds": 86400, "purpose": "runaway-guard"},
 "excluded_studies": ["F5", "F4-fold-0", "29-census-parents", "R30", "strict", "probe", "serving", "D4096", "t34-round0-study-01", "sandbox-a-train01-monitor", "sandbox-a-train01-nomination"],
 "owner_rule": "docs/research/governance_a100_sandbox_20261026/ADOPTED.md",
 "outputs": {"label": "simulator-D", "paths": ["/Users/josenunez/Projects/ml/snake-dqn-artifacts/t34-cf-1028/attempt-02/output"], "broker_manifest": {"path": "/Users/josenunez/Projects/ml/snake-dqn-ct-1028-02-broker.noindex/research/sandbox_a_resident/packet-ct-1028-02/dispatch-manifest.json", "sha256": "0540127e90254bc66db7d9c2b8121a4389a5352611cbb347041d309bd5df6b48"}},
 "crossing": {"max_frozen_checkpoint_shas": 1}}
